Loading from hoff  ../../examples/SMS_SPAM/data_pipeline/sms_pickle_L.pkl
batch size 100
num features 1024
num classes 2
num rules 16
1  ->  0
0  ->  1
None  ->  2
----------------------------
{1: 0, 0: 1, None: 2}
----------------------------
len_x 100
len_r 100
--------------------------
Working with l
--------------------------
Working with L
--------------------------
Loading from hoff  ../../examples/SMS_SPAM/data_pipeline/sms_pickle_U.pkl
batch size 5174
num features 1024
num classes 2
num rules 16
1  ->  0
0  ->  1
None  ->  2
----------------------------
{1: 0, 0: 1, None: 2}
----------------------------
len_x 5174
len_r 5174
--------------------------
Working with l
--------------------------
Working with L
L is empty
--------------------------
No valid label found for rule:  2
No valid label found for rule:  4
No valid label found for rule:  6
Rule classes:  [0, 0, 2, 1, 2, 1, 2, 0, 0, 0, 0, 1, 1, 1, 1, 0]
length of covered U: 2984
Size of d before oversampling:  100
Size of U (covered) :  2984
Size of d after oversampling:  1000
Size of d_U after combining:  3984
Loading 100 elements from d
num instances in d:  1000
Loading from hoff  ../../examples/SMS_SPAM/data_pipeline/sms_pickle_V.pkl
batch size 100
num features 1024
num classes 2
num rules 16
1  ->  0
0  ->  1
None  ->  2
----------------------------
{1: 0, 0: 1, None: 2}
----------------------------
len_x 100
len_r 100
--------------------------
Working with l
--------------------------
Working with L
--------------------------
Setting value of d to 0 for test data
test_w len:  64
test_w len:  64
Number of features:  1024
Number of classes:  2
Print num of rules to train:  16
Print num of rules:  16



Found prev best metric for run type f_d: 1.000
best metrics dict:  {'f1_score_1': 1.0, 'precision_1': 1.0, 'recall_1': 1.0, 'support_1': 89, 'f1_score': array([1., 1.]), 'precision': array([1., 1.]), 'recall': array([1., 1.]), 'support': array([11, 89]), 'avg_f1_score': 1.0, 'avg_precision': 1.0, 'avg_recall': 1.0, 'accuracy': 1.0, 'epoch': 2.0, 'f_d_global_step': 124}
Found prev best metric for run type f_d_U: 1.000
best metrics dict:  {'f1_score_1': 1.0, 'precision_1': 1.0, 'recall_1': 1.0, 'support_1': 89, 'f1_score': array([1., 1.]), 'precision': array([1., 1.]), 'recall': array([1., 1.]), 'support': array([11, 89]), 'avg_f1_score': 1.0, 'avg_precision': 1.0, 'avg_recall': 1.0, 'accuracy': 1.0, 'epoch': 3.0, 'f_d_global_step': 372}
[
    "<tf.Variable 'global_step:0' shape=() dtype=int64_ref>",
    "<tf.Variable 'f_d_global_step:0' shape=() dtype=int32_ref>",
    "<tf.Variable 'f_network/dense/kernel:0' shape=(1024, 512) dtype=float32_ref>",
    "<tf.Variable 'f_network/dense/bias:0' shape=(512,) dtype=float32_ref>",
    "<tf.Variable 'f_network/dense_1/kernel:0' shape=(512, 512) dtype=float32_ref>",
    "<tf.Variable 'f_network/dense_1/bias:0' shape=(512,) dtype=float32_ref>",
    "<tf.Variable 'f_network/dense_2/kernel:0' shape=(512, 2) dtype=float32_ref>",
    "<tf.Variable 'f_network/dense_2/bias:0' shape=(2,) dtype=float32_ref>",
    "<tf.Variable 'beta1_power:0' shape=() dtype=float32_ref>",
    "<tf.Variable 'beta2_power:0' shape=() dtype=float32_ref>",
    "<tf.Variable 'f_network/dense/kernel/f_d_Adam:0' shape=(1024, 512) dtype=float32_ref>",
    "<tf.Variable 'f_network/dense/kernel/f_d_Adam_1:0' shape=(1024, 512) dtype=float32_ref>",
    "<tf.Variable 'f_network/dense/bias/f_d_Adam:0' shape=(512,) dtype=float32_ref>",
    "<tf.Variable 'f_network/dense/bias/f_d_Adam_1:0' shape=(512,) dtype=float32_ref>",
    "<tf.Variable 'f_network/dense_1/kernel/f_d_Adam:0' shape=(512, 512) dtype=float32_ref>",
    "<tf.Variable 'f_network/dense_1/kernel/f_d_Adam_1:0' shape=(512, 512) dtype=float32_ref>",
    "<tf.Variable 'f_network/dense_1/bias/f_d_Adam:0' shape=(512,) dtype=float32_ref>",
    "<tf.Variable 'f_network/dense_1/bias/f_d_Adam_1:0' shape=(512,) dtype=float32_ref>",
    "<tf.Variable 'f_network/dense_2/kernel/f_d_Adam:0' shape=(512, 2) dtype=float32_ref>",
    "<tf.Variable 'f_network/dense_2/kernel/f_d_Adam_1:0' shape=(512, 2) dtype=float32_ref>",
    "<tf.Variable 'f_network/dense_2/bias/f_d_Adam:0' shape=(2,) dtype=float32_ref>",
    "<tf.Variable 'f_network/dense_2/bias/f_d_Adam_1:0' shape=(2,) dtype=float32_ref>",
    "<tf.Variable 'f_d_U_global_step:0' shape=() dtype=int32_ref>",
    "<tf.Variable 'w_network/w_layer_0/kernel:0' shape=(1040, 512) dtype=float32_ref>",
    "<tf.Variable 'w_network/w_layer_0/bias:0' shape=(512,) dtype=float32_ref>",
    "<tf.Variable 'w_network/w_layer_1/kernel:0' shape=(512, 512) dtype=float32_ref>",
    "<tf.Variable 'w_network/w_layer_1/bias:0' shape=(512,) dtype=float32_ref>",
    "<tf.Variable 'w_network/w_linear_layer/kernel:0' shape=(512, 1) dtype=float32_ref>",
    "<tf.Variable 'w_network/w_linear_layer/bias:0' shape=(1,) dtype=float32_ref>",
    "<tf.Variable 'beta1_power_1:0' shape=() dtype=float32_ref>",
    "<tf.Variable 'beta2_power_1:0' shape=() dtype=float32_ref>",
    "<tf.Variable 'f_network/dense/kernel/f_d_U_Adam:0' shape=(1024, 512) dtype=float32_ref>",
    "<tf.Variable 'f_network/dense/kernel/f_d_U_Adam_1:0' shape=(1024, 512) dtype=float32_ref>",
    "<tf.Variable 'f_network/dense/bias/f_d_U_Adam:0' shape=(512,) dtype=float32_ref>",
    "<tf.Variable 'f_network/dense/bias/f_d_U_Adam_1:0' shape=(512,) dtype=float32_ref>",
    "<tf.Variable 'f_network/dense_1/kernel/f_d_U_Adam:0' shape=(512, 512) dtype=float32_ref>",
    "<tf.Variable 'f_network/dense_1/kernel/f_d_U_Adam_1:0' shape=(512, 512) dtype=float32_ref>",
    "<tf.Variable 'f_network/dense_1/bias/f_d_U_Adam:0' shape=(512,) dtype=float32_ref>",
    "<tf.Variable 'f_network/dense_1/bias/f_d_U_Adam_1:0' shape=(512,) dtype=float32_ref>",
    "<tf.Variable 'f_network/dense_2/kernel/f_d_U_Adam:0' shape=(512, 2) dtype=float32_ref>",
    "<tf.Variable 'f_network/dense_2/kernel/f_d_U_Adam_1:0' shape=(512, 2) dtype=float32_ref>",
    "<tf.Variable 'f_network/dense_2/bias/f_d_U_Adam:0' shape=(2,) dtype=float32_ref>",
    "<tf.Variable 'f_network/dense_2/bias/f_d_U_Adam_1:0' shape=(2,) dtype=float32_ref>",
    "<tf.Variable 'w_network/w_layer_0/kernel/f_d_U_Adam:0' shape=(1040, 512) dtype=float32_ref>",
    "<tf.Variable 'w_network/w_layer_0/kernel/f_d_U_Adam_1:0' shape=(1040, 512) dtype=float32_ref>",
    "<tf.Variable 'w_network/w_layer_0/bias/f_d_U_Adam:0' shape=(512,) dtype=float32_ref>",
    "<tf.Variable 'w_network/w_layer_0/bias/f_d_U_Adam_1:0' shape=(512,) dtype=float32_ref>",
    "<tf.Variable 'w_network/w_layer_1/kernel/f_d_U_Adam:0' shape=(512, 512) dtype=float32_ref>",
    "<tf.Variable 'w_network/w_layer_1/kernel/f_d_U_Adam_1:0' shape=(512, 512) dtype=float32_ref>",
    "<tf.Variable 'w_network/w_layer_1/bias/f_d_U_Adam:0' shape=(512,) dtype=float32_ref>",
    "<tf.Variable 'w_network/w_layer_1/bias/f_d_U_Adam_1:0' shape=(512,) dtype=float32_ref>",
    "<tf.Variable 'w_network/w_linear_layer/kernel/f_d_U_Adam:0' shape=(512, 1) dtype=float32_ref>",
    "<tf.Variable 'w_network/w_linear_layer/kernel/f_d_U_Adam_1:0' shape=(512, 1) dtype=float32_ref>",
    "<tf.Variable 'w_network/w_linear_layer/bias/f_d_U_Adam:0' shape=(1,) dtype=float32_ref>",
    "<tf.Variable 'w_network/w_linear_layer/bias/f_d_U_Adam_1:0' shape=(1,) dtype=float32_ref>"
]
Run mode is pr_loss
begin pr_loss training
num_instances:  3984
batch_size:  32
total_batch:  124
remaining:  16
total_batch:  124
Optimization started for f_d_U with pr_loss loss!
Batch size: 32!
Batches per epoch : 124!
Number of epochs: 4!

========== epoch : 0 ============

cost: 0.33065247301372797

patience: 0


metrics_dict:  {'f1_score_1': 1.0, 'precision_1': 1.0, 'recall_1': 1.0, 'support_1': 89, 'f1_score': array([1.000, 1.000]), 'precision': array([1.000, 1.000]), 'recall': array([1.000, 1.000]), 'support': array([11, 89]), 'avg_f1_score': 1.0, 'avg_precision': 1.0, 'avg_recall': 1.0, 'accuracy': 1.0, 'epoch': 1.0, 'f_d_global_step': 124}

Reporting f_d metrics to tensorboard
Not saving metrics dict. Best metric value is 1.0 Current is: 1.0

Saved MRU checkpoint to path:  ./checkpoint/hls-model-124

Saved new best checkpoint to path:  ./checkpoint/f_d_U/best.ckpt-124


========== epoch : 1 ============

cost: 0.16753583469037567

patience: 1


metrics_dict:  {'f1_score_1': 1.0, 'precision_1': 1.0, 'recall_1': 1.0, 'support_1': 89, 'f1_score': array([1.000, 1.000]), 'precision': array([1.000, 1.000]), 'recall': array([1.000, 1.000]), 'support': array([11, 89]), 'avg_f1_score': 1.0, 'avg_precision': 1.0, 'avg_recall': 1.0, 'accuracy': 1.0, 'epoch': 2.0, 'f_d_global_step': 248}

Reporting f_d metrics to tensorboard
Not saving metrics dict. Best metric value is 1.0 Current is: 1.0

Saved MRU checkpoint to path:  ./checkpoint/hls-model-249

No new best checkpoint. Did not save a new best checkpoint. Last checkpointed file:  ./checkpoint/f_d_U/best.ckpt-124


========== epoch : 2 ============

cost: 0.12673024363785745

patience: 2


metrics_dict:  {'f1_score_1': 1.0, 'precision_1': 1.0, 'recall_1': 1.0, 'support_1': 89, 'f1_score': array([1.000, 1.000]), 'precision': array([1.000, 1.000]), 'recall': array([1.000, 1.000]), 'support': array([11, 89]), 'avg_f1_score': 1.0, 'avg_precision': 1.0, 'avg_recall': 1.0, 'accuracy': 1.0, 'epoch': 3.0, 'f_d_global_step': 372}

Reporting f_d metrics to tensorboard
Not saving metrics dict. Best metric value is 1.0 Current is: 1.0

Saved MRU checkpoint to path:  ./checkpoint/hls-model-374

No new best checkpoint. Did not save a new best checkpoint. Last checkpointed file:  ./checkpoint/f_d_U/best.ckpt-124


========== epoch : 3 ============

cost: 0.11480338782853174

patience: 3


metrics_dict:  {'f1_score_1': 1.0, 'precision_1': 1.0, 'recall_1': 1.0, 'support_1': 89, 'f1_score': array([1.000, 1.000]), 'precision': array([1.000, 1.000]), 'recall': array([1.000, 1.000]), 'support': array([11, 89]), 'avg_f1_score': 1.0, 'avg_precision': 1.0, 'avg_recall': 1.0, 'accuracy': 1.0, 'epoch': 4.0, 'f_d_global_step': 496}

Reporting f_d metrics to tensorboard
Not saving metrics dict. Best metric value is 1.0 Current is: 1.0

Saved MRU checkpoint to path:  ./checkpoint/hls-model-499

No new best checkpoint. Did not save a new best checkpoint. Last checkpointed file:  ./checkpoint/f_d_U/best.ckpt-124

Optimization Finished for f_d_U!
pr_loss training end
